{
  "schemaVersion": 1,
  "migrationId": "recipe-id-v1-to-v2-2026.07.28.1",
  "fromSchemaVersion": 1,
  "toSchemaVersion": 2,
  "dataVersion": "2026.07.28.1",
  "mappings": [
    {
      "oldId": "aquatic_17b4109a",
      "newId": "e5864827-9af0-4663-9528-46490974f29a",
      "category": "aquatic",
      "name": "蒜香黄油虾"
    },
    {
      "oldId": "aquatic_2749d071",
      "newId": "b01b4231-5bc8-4102-90a4-7bbeb709b642",
      "category": "aquatic",
      "name": "小龙虾"
    },
    {
      "oldId": "aquatic_28c2e3b4",
      "newId": "51c7e2aa-7abb-4e21-b206-2c67b0c952a7",
      "category": "aquatic",
      "name": "红烧鲤鱼"
    },
    {
      "oldId": "aquatic_28c3c7c3",
      "newId": "05a523a7-48b0-44ed-975a-77d45f17cf64",
      "category": "aquatic",
      "name": "白灼虾"
    },
    {
      "oldId": "aquatic_376efe24",
      "newId": "2c1c9338-dd9a-44ca-9c23-f4828f939914",
      "category": "aquatic",
      "name": "葱烧海参"
    },
    {
      "oldId": "aquatic_3c11a1ee",
      "newId": "cb344a6f-f851-4ede-a249-2ce276009d52",
      "category": "aquatic",
      "name": "微波葱姜黑鳕鱼"
    },
    {
      "oldId": "aquatic_43c732f1",
      "newId": "056993ce-2f49-469b-be1e-3454612ecb56",
      "category": "aquatic",
      "name": "蛏抱蛋"
    },
    {
      "oldId": "aquatic_45c4788b",
      "newId": "8314675b-a89b-457d-8e26-81c8ee9a8bb5",
      "category": "aquatic",
      "name": "黄油煎虾"
    },
    {
      "oldId": "aquatic_5603da82",
      "newId": "2ea39c71-ea58-4c33-8008-4079f5998411",
      "category": "aquatic",
      "name": "芥末黄油罗氏虾"
    },
    {
      "oldId": "aquatic_5ee1668c",
      "newId": "fc7fe00d-3436-4e7c-8cb0-5f9870fd8087",
      "category": "aquatic",
      "name": "干煎阿根廷红虾"
    },
    {
      "oldId": "aquatic_706ce316",
      "newId": "3d7c1fd1-af9b-48bb-8f1e-72979d560887",
      "category": "aquatic",
      "name": "烤鱼"
    },
    {
      "oldId": "aquatic_7093e3ab",
      "newId": "ae4d1d90-e951-46f2-8eec-55737a168170",
      "category": "aquatic",
      "name": "香煎翘嘴鱼"
    },
    {
      "oldId": "aquatic_849a47d1",
      "newId": "677cec1a-989a-477a-a7e8-04869dcb4e43",
      "category": "aquatic",
      "name": "清蒸鲈鱼"
    },
    {
      "oldId": "aquatic_8bfd57d8",
      "newId": "585d2fe1-c997-4a7a-b47d-230505654010",
      "category": "aquatic",
      "name": "糖醋鲤鱼"
    },
    {
      "oldId": "aquatic_8e3251fb",
      "newId": "16efa6d4-de27-4c57-bb13-3c9f30c7a647",
      "category": "aquatic",
      "name": "红烧鱼头"
    },
    {
      "oldId": "aquatic_97b24536",
      "newId": "0b6e18c4-9ef4-4306-8f9c-65f8a32c097f",
      "category": "aquatic",
      "name": "咖喱炒蟹"
    },
    {
      "oldId": "aquatic_9b178156",
      "newId": "096adf0f-dd6a-4c06-af7d-975787221f2f",
      "category": "aquatic",
      "name": "油焖大虾"
    },
    {
      "oldId": "aquatic_a7a91bd9",
      "newId": "7e4f4c25-ca7b-46ec-83d3-612020768a05",
      "category": "aquatic",
      "name": "红烧鱼"
    },
    {
      "oldId": "aquatic_c2b2b20e",
      "newId": "f75fbb85-ca3f-49d5-acf7-09aae4bd6a84",
      "category": "aquatic",
      "name": "蒜蓉虾"
    },
    {
      "oldId": "aquatic_cde57a22",
      "newId": "eaa8869d-0e12-4d34-aff2-5765d460c099",
      "category": "aquatic",
      "name": "水煮鱼"
    },
    {
      "oldId": "aquatic_d10b5ae7",
      "newId": "399719f2-8aa2-428b-8c3a-260b52a137f6",
      "category": "aquatic",
      "name": "清蒸生蚝"
    },
    {
      "oldId": "aquatic_d4c3eb44",
      "newId": "07674d51-263f-44e1-affd-e35d24318473",
      "category": "aquatic",
      "name": "鳊鱼炖豆腐"
    },
    {
      "oldId": "aquatic_d63cc518",
      "newId": "f209570d-3558-4ca0-890b-3539090f91c1",
      "category": "aquatic",
      "name": "鲤鱼炖白菜"
    },
    {
      "oldId": "aquatic_e47c3c99",
      "newId": "3a7922c8-3499-4154-b743-66815350001f",
      "category": "aquatic",
      "name": "葱油桂鱼"
    },
    {
      "oldId": "breakfast_1376754e",
      "newId": "98ee475c-7508-411d-a9d3-e429ee000ab3",
      "category": "breakfast",
      "name": "溏心蛋"
    },
    {
      "oldId": "breakfast_1990d584",
      "newId": "bda4dbbd-bcff-44e3-9654-8058bf959114",
      "category": "breakfast",
      "name": "手抓饼"
    },
    {
      "oldId": "breakfast_317b5386",
      "newId": "a4b4b7c4-9be4-4dfc-925c-b9cc8a91c3a3",
      "category": "breakfast",
      "name": "牛奶燕麦"
    },
    {
      "oldId": "breakfast_3850601a",
      "newId": "9f2d1398-cfeb-4248-b129-76517a4cdbf1",
      "category": "breakfast",
      "name": "微波炉荷包蛋"
    },
    {
      "oldId": "breakfast_3e582990",
      "newId": "13e750cb-3d32-47fe-ab0f-1ccc77caa87d",
      "category": "breakfast",
      "name": "苏格兰蛋"
    },
    {
      "oldId": "breakfast_45c75ea6",
      "newId": "ee419a19-80f3-4a74-8de5-e98ff61c0e02",
      "category": "breakfast",
      "name": "完美水煮蛋"
    },
    {
      "oldId": "breakfast_6bcc5369",
      "newId": "7fca3472-00d2-4906-8347-c40a9ffb8028",
      "category": "breakfast",
      "name": "温泉蛋"
    },
    {
      "oldId": "breakfast_6f83af1c",
      "newId": "b72ae61a-5433-4587-88a3-1a0dfc69bcdf",
      "category": "breakfast",
      "name": "蒸水蛋"
    },
    {
      "oldId": "breakfast_72f84032",
      "newId": "35c9c6a7-7049-4e00-addb-81000584829d",
      "category": "breakfast",
      "name": "茶叶蛋"
    },
    {
      "oldId": "breakfast_74832fb6",
      "newId": "8768a242-ce3f-4802-941e-bced9d3b63d1",
      "category": "breakfast",
      "name": "空气炸锅面包片"
    },
    {
      "oldId": "breakfast_86643b0a",
      "newId": "7f519e10-7d66-4951-90b3-a432d8186655",
      "category": "breakfast",
      "name": "燕麦鸡蛋饼"
    },
    {
      "oldId": "breakfast_8df15267",
      "newId": "ca33fa58-c716-4b62-aa60-483868d737b9",
      "category": "breakfast",
      "name": "蒸花卷"
    },
    {
      "oldId": "breakfast_a04cfccc",
      "newId": "d3704d61-e9bf-4a7c-b09f-3dc9141ab831",
      "category": "breakfast",
      "name": "水煮玉米"
    },
    {
      "oldId": "breakfast_a065206f",
      "newId": "819c4fb6-96b5-4c2a-a89c-5126e596d16f",
      "category": "breakfast",
      "name": "金枪鱼酱三明治"
    },
    {
      "oldId": "breakfast_af382287",
      "newId": "fa62e856-5b3a-41f1-be4b-864cbc4d9503",
      "category": "breakfast",
      "name": "煎饺"
    },
    {
      "oldId": "breakfast_c3d2a2fd",
      "newId": "b2b47d8c-dbfb-495e-bf95-301f3da990db",
      "category": "breakfast",
      "name": "鸡蛋三明治"
    },
    {
      "oldId": "breakfast_c7c510a4",
      "newId": "b44b34ca-b69f-4999-a252-ab8f53a16c97",
      "category": "breakfast",
      "name": "蛋煎糍粑"
    },
    {
      "oldId": "breakfast_e892f89c",
      "newId": "5df96365-8224-47f9-8b45-ea9c364dc443",
      "category": "breakfast",
      "name": "桂圆红枣粥"
    },
    {
      "oldId": "breakfast_eb6189c2",
      "newId": "01e84fc0-fb57-497b-b06a-917b4e6a79cb",
      "category": "breakfast",
      "name": "美式炒蛋"
    },
    {
      "oldId": "breakfast_efd07d35",
      "newId": "09b23a99-474f-4cf4-a309-740436b7d8e7",
      "category": "breakfast",
      "name": "微波炉蛋糕"
    },
    {
      "oldId": "breakfast_f46d05b8",
      "newId": "093ee232-ba99-4945-abd9-57db4fab7722",
      "category": "breakfast",
      "name": "太阳蛋"
    },
    {
      "oldId": "breakfast_fc251fde",
      "newId": "581c1e01-da8b-4cbc-bca3-24548fadd9e2",
      "category": "breakfast",
      "name": "吐司果酱"
    },
    {
      "oldId": "condiment_231c5b16",
      "newId": "e262370f-49ba-4f7a-905d-38a72de1761f",
      "category": "condiment",
      "name": "葱油"
    },
    {
      "oldId": "condiment_241627f2",
      "newId": "b96127e1-c85c-45ca-a868-295801edcf19",
      "category": "condiment",
      "name": "草莓酱"
    },
    {
      "oldId": "condiment_2499dc8b",
      "newId": "55ed76f3-5608-47ef-851b-c947ff11ef56",
      "category": "condiment",
      "name": "油酥"
    },
    {
      "oldId": "condiment_28d7cc43",
      "newId": "93e876c3-55f9-4b9e-b648-7ec64c065a7f",
      "category": "condiment",
      "name": "炸串酱料"
    },
    {
      "oldId": "condiment_3b554f0d",
      "newId": "8fd5c09e-094a-4e1f-9489-52f3b17e08f3",
      "category": "condiment",
      "name": "油泼辣子"
    },
    {
      "oldId": "condiment_491d23fe",
      "newId": "5271553e-3a9d-4740-8003-dcc6d7ffd744",
      "category": "condiment",
      "name": "糖醋汁"
    },
    {
      "oldId": "condiment_6df7e885",
      "newId": "f653e9d8-a27a-4f0d-8bff-1fac8294c796",
      "category": "condiment",
      "name": "蒜香酱油"
    },
    {
      "oldId": "condiment_7d5996ac",
      "newId": "9974d1d8-9426-4ecf-955b-a1298a6cdaa3",
      "category": "condiment",
      "name": "简易版炒糖色"
    },
    {
      "oldId": "condiment_f276bc66",
      "newId": "bd25a4f7-fa96-4571-a390-df68ba4a598c",
      "category": "condiment",
      "name": "蔗糖糖浆"
    },
    {
      "oldId": "dessert_07c13985",
      "newId": "db822973-93a7-4075-9ae4-9b9cd4b671bf",
      "category": "dessert",
      "name": "反沙芋头"
    },
    {
      "oldId": "dessert_11ac695f",
      "newId": "81fd661c-d235-4e2b-a8c6-71977e4f3dbf",
      "category": "dessert",
      "name": "红柚蛋糕"
    },
    {
      "oldId": "dessert_394b4614",
      "newId": "1783e502-816f-45c8-b797-f8d94b2051de",
      "category": "dessert",
      "name": "玛格丽特饼干"
    },
    {
      "oldId": "dessert_41a0ab6c",
      "newId": "7976af2a-a07f-4265-ac2a-29ee3811cf8a",
      "category": "dessert",
      "name": "炸鲜奶"
    },
    {
      "oldId": "dessert_448181d9",
      "newId": "4add91ec-80d0-4f2f-b745-396e2f14fdc2",
      "category": "dessert",
      "name": "烤箱版巴斯克芝士蛋糕"
    },
    {
      "oldId": "dessert_48708a65",
      "newId": "b0b1e080-997d-458e-b956-7a4ef8340965",
      "category": "dessert",
      "name": "酸奶意式奶冻"
    },
    {
      "oldId": "dessert_6b0341a7",
      "newId": "51e511d9-8906-49ac-8879-511a3db89197",
      "category": "dessert",
      "name": "雪花酥"
    },
    {
      "oldId": "dessert_6b3856a6",
      "newId": "f8b4f227-35d3-4619-a122-f82164659313",
      "category": "dessert",
      "name": "提拉米苏"
    },
    {
      "oldId": "dessert_6bbb6512",